Url,ImageUrl,StyleNumber,Color,Size,Name,ReviewNumber,MaxPrice,Brand,Bullets,Description,Sport,AverageRating,Clothing,MinPrice,Gender
https://athleta.gap.com/browse/product.do?pid=501019002&cid=1023333&pcid=1006482&vid=1&grid=pds_32_193_1,https://athleta.gap.com/webcontent/0017/778/778/cn17778778.jpg,501019,['Arbor Olive'],"['XXS', 'XS', 'S', 'M', 'L', 'XL']",Leopard Elation Ultra High Rise Tight in Powervita,82,"{'price': '89.00', 'update_time': '2019-10-16'}",athleta,"['Nylon/Lycra ', 'WICKING. Pulls sweat away from the body so it can evaporate faster ', 'BREATHABLE. Sweat can travel through the fabric so it can evaporate on the surface ', 'QUICK-DRYING. Dries in a flash for the ultimate comfort when breaking a sweat ', 'RATED UPF 50+ (Excellent Protection) ', 'Machine wash and dry. ', 'Imported. ', 'Product Details : FOR: Indoor and outdoor yoga practice, and life off the matFEEL: Powervita™  fabric is buttery soft to the touch with support that feels like a gentle hugFAVE: Three-layer unpinchable waistband smooths and supportsBack drop-in pocket holds your essentials #501019']",,,4.8,,"{'price': '89.00', 'update_time': '2019-10-16'}",women
https://athleta.gap.com/browse/product.do?pid=500916002&cid=1144496&pcid=1006482&vid=1&grid=pds_15_193_1,https://athleta.gap.com/webcontent/0017/816/718/cn17816718.jpg,500916,['Black'],"['XXS', 'XS', 'S', 'M', 'L', 'XL']",Ritual Jacket,16,"{'price': '148.00', 'update_time': '2019-10-16'}",athleta,"['Polyester ', 'Machine wash and dry. ', 'Imported. ', 'Product Details : FOR: To and from yoga practice and studio workoutsFEEL: Unbelievably cozy faux-fur keeps you warm in the coldFAVE: Sleek grosgrain detailing offers a streamlined, flattering fitZip pockets secure your essentialsAdjustable drawcord on hood for a custom fit #500916']",,,4.7,,"{'price': '148.00', 'update_time': '2019-10-16'}",women
https://athleta.gap.com/browse/product.do?pid=486317032&cid=1023334&pcid=1006482&vid=1&grid=pds_59_193_1,https://athleta.gap.com/webcontent/0017/661/545/cn17661545.jpg,486317,['Light Grey/ White'],"['XS', 'S', 'M', 'L', 'XL']",Flurry Peak Turtleneck,14,"{'price': '89.00', 'update_time': '2019-10-16'}",athleta,"['Nylon ', 'UNSTINKABLE. Odor-controlling yarns ', 'BREATHABLE. Sweat can travel through the fabric so it can evaporate on the surface ', 'WICKING. Pulls sweat away from the body so it can evaporate faster ', 'UPF 50+ ', 'Machine wash and dry. ', 'Imported. ', 'Product Details : FOR: Medium and high impact workouts in cold climatesFEEL: Chafe-free seamless fabric stretches with every moveFAVE: Thumbholes keep your sleeves in place #486317']",,,4.7,,"{'price': '89.00', 'update_time': '2019-10-16'}",women
https://athleta.gap.com/browse/product.do?pid=499300002&cid=1023333&pcid=1006482&vid=8&grid=pds_37_193_1,https://athleta.gap.com/webcontent/0017/411/084/cn17411084.jpg,499300,['Antique Burgundy'],"['1X', '2X', '3X']",Tenacity 7/8 Tight in Powerlift,1,"{'price': '98.00', 'update_time': '2019-10-16'}",athleta,"['Polyester/Lycra ', 'WICKING. Pulls sweat away from the body so it can evaporate faster ', 'BREATHABLE. Sweat can travel through the fabric so it can evaporate on the surface ', 'Machine wash and dry. ', 'Imported. ', 'Product Details : FOR: Training on the mat or in the ring.FEEL: PowerLift fabric feels smooth and cool in your hand, sleek and compressive on your body.FAVE: Stretchy, secure waistband provides unparalleled supportBonded stash pockets store your essentialsTargeted mesh ventilation provides cooling airflow #499300']",,,3.0,,"{'price': '98.00', 'update_time': '2019-10-16'}",women
https://athleta.gap.com/browse/product.do?pid=487745002&cid=1023333&pcid=1006482&vid=1&grid=pds_51_193_1,https://athleta.gap.com/webcontent/0017/807/078/cn17807078.jpg,487745,['Black'],"['XXS', 'XS', 'S', 'M', 'L', 'XL']",Rainier Tight in Plush SuperSonic,13,"{'price': '98.00', 'update_time': '2019-10-16'}",athleta,"['Recycled Nylon/Lycra ', 'SUSTAINABLE: Made with Recycled Nylon, a high-performance material that helps lessen our impact on the world ', 'BREATHABLE. Sweat can travel through the fabric so it can evaporate on the surface ', 'QUICK-DRYING. Dries in a flash for the ultimate comfort when breaking a sweat ', 'WICKING. Pulls sweat away from the body so it can evaporate faster ', 'Machine wash and dry. ', 'Imported. ', 'Product Details : FOR: Medium and high impact workouts in cold climatesFEEL: Plush SuperSonic has a soft, brushed interiorFAVE: Zip pockets secure your essentialsBack drop-in pocket stashes your smartphoneReflective details for early morning or after-dusk workouts #487745']",,,4.5,,"{'price': '98.00', 'update_time': '2019-10-16'}",women
https://athleta.gap.com/browse/product.do?pid=417739022&cid=1023336&pcid=1006482&vid=1&grid=pds_166_193_1,https://athleta.gap.com/webcontent/0017/335/785/cn17335785.jpg,417739,['Iron Blue Heather'],"['XXS', 'XS', 'S', 'M', 'L', 'XL']",Mindset Sweatshirt Dress,91,"{'price': '89.00', 'update_time': '2019-10-16'}",athleta,"['TENCEL Modal™/Spandex ', 'BREATHABLE. Sweat can travel through the fabric so it can evaporate on the surface ', 'SUSTAINABLE: TENCEL Modal™ is a fiber that is produced from European beechwood trees harvested from sustainable forests where 99% of the raw material comes from certified or controlled sources ', 'EASY CARE. Just throw in the wash and dry without a second thought ', 'Machine wash and dry. ', 'Imported. ', 'Product Details : FOR: To and from yoga practice and studio workoutsFEEL: Nirvana is the softest fabric imaginableFAVE: Tulip-edged hemline flatters your form #417739']",,,4.5,,"{'price': '89.00', 'update_time': '2019-10-16'}",women
https://athleta.gap.com/browse/product.do?pid=487732012&cid=1023333&pcid=1006482&vid=1&grid=pds_36_193_1,https://athleta.gap.com/webcontent/0017/651/947/cn17651947.jpg,487732,['Black'],"['XXS', 'XS', 'S', 'M', 'L', 'XL']",Tenacity 7/8 Tight in Powerlift,2,"{'price': '98.00', 'update_time': '2019-10-16'}",athleta,"['Polyester/Lycra ', 'WICKING. Pulls sweat away from the body so it can evaporate faster ', 'BREATHABLE. Sweat can travel through the fabric so it can evaporate on the surface ', 'RATED UPF 50+ (Excellent Protection) ', 'Machine wash and dry. ', 'Imported. ', 'Product Details : FOR: Training on the mat, in the ring, or other medium and high impact workouts. Wear at the gym, in the studio, or outdoors.FEEL: PowerLift fabric feels smooth and cool in your hand, sleek and compressive on your body.FAVE: Stretchy, secure waistband provides unparalleled supportStash pockets store your smartphone and essentialsBreathable CoolMax® crotch gusset #487732']",,,3.0,,"{'price': '98.00', 'update_time': '2019-10-16'}",women
https://athleta.gap.com/browse/product.do?pid=531260042&cid=1023334&pcid=1006482&vid=1&grid=pds_74_193_1,https://athleta.gap.com/webcontent/0017/667/612/cn17667612.jpg,531260,['Antique Burgundy'],"['XXS', 'XS', 'S', 'M', 'L', 'XL']",Essence Twist Top,14,"{'price': '59.00', 'update_time': '2019-10-16'}",athleta,"['Recycled Polyester/Lyocell/Spandex ', 'WICKING. Pulls sweat away from the body so it can evaporate faster ', 'SUSTAINABLE: Made from Recycled Poly, a material sourced from post-consumer plastic bottles that helps lessen our impact on the world ', 'UNSTINKABLE. Odor-controlling yarns ', 'Machine wash and dry. ', 'Imported. ', 'Product Details : FOR: To and from yoga practice and studio workoutsFEEL: Soft and lightweight recycled fabricFAVE: Front twist detail adds fashion to your practice. #531260']",,,4.5,,"{'price': '59.00', 'update_time': '2019-10-16'}",women
https://athleta.gap.com/browse/product.do?pid=511388022&cid=1144189&pcid=1006482&vid=1&grid=pds_25_193_1,https://athleta.gap.com/webcontent/0017/778/768/cn17778768.jpg,511388,['Arbor Olive Leopard Print'],"['XXS', 'XS', 'S', 'M', 'L', 'XL']",A-C Actualize Longline Bra,29,"{'price': '54.00', 'update_time': '2019-10-16'}",athleta,"['Nylon/Lycra ', 'WICKING. Pulls sweat away from the body so it can evaporate faster ', 'QUICK-DRYING. Dries in a flash for the ultimate comfort when breaking a sweat ', 'BREATHABLE. Sweat can travel through the fabric so it can evaporate on the surface ', 'RATED UPF 50+ (Excellent Protection) ', 'Machine wash and line dry. ', 'Imported. ', 'Product Details : FOR: Indoor and outdoor yoga practice, and life off the matFEEL: Powervita™  fabric is buttery soft to the touch with support that feels like a gentle hugFAVE: Longline design provides more coverage and a fit that stays putNew lightweight removable pads provide a more natural shape #511388']",,,4.9,,"{'price': '54.00', 'update_time': '2019-10-16'}",women
https://athleta.gap.com/browse/product.do?pid=515556022&cid=1023334&pcid=1006482&vid=1&grid=pds_107_193_1,https://athleta.gap.com/webcontent/0017/662/032/cn17662032.jpg,515556,['Spring Night'],"['XXS', 'XS', 'S', 'M', 'L', 'XL']",Nirvana Side Tie Sweatshirt,3,"{'price': '79.00', 'update_time': '2019-10-16'}",athleta,"['TENCEL™ Modal/Cotton/Spandex ', 'SUSTAINABLE: TENCEL™ Modal fiber is made from sustainably sourced wood pulp where 99% of the raw material comes from certified or controlled sources ', 'EASY CARE. Just throw in the wash and dry without a second thought ', 'PACKABLE. Packs down small and comes out smooth as can be ', 'Machine wash and dry. ', 'Imported. ', 'Product Details : FOR: Indoor and outdoor yoga practice, and life off the matFEEL: Nirvana is the softest fabric imaginableFAVE: Side tie details let you customize your fit #515556']",,,3.0,,"{'price': '79.00', 'update_time': '2019-10-16'}",women
https://athleta.gap.com/browse/product.do?pid=417739032&cid=1023336&pcid=1006482&vid=1&grid=pds_165_193_1,https://athleta.gap.com/webcontent/0017/300/060/cn17300060.jpg,417739,['Maple Red Heather'],"['XXS', 'XS', 'S', 'M', 'L', 'XL']",Mindset Sweatshirt Dress,91,"{'price': '89.00', 'update_time': '2019-10-16'}",athleta,"['TENCEL Modal™/Spandex ', 'BREATHABLE. Sweat can travel through the fabric so it can evaporate on the surface ', 'SUSTAINABLE: TENCEL Modal™ is a fiber that is produced from European beechwood trees harvested from sustainable forests where 99% of the raw material comes from certified or controlled sources ', 'EASY CARE. Just throw in the wash and dry without a second thought ', 'Machine wash and dry. ', 'Imported. ', 'Product Details : FOR: To and from yoga practice and studio workoutsFEEL: Nirvana is the softest fabric imaginableFAVE: Tulip-edged hemline flatters your form #417739']",,,4.5,,"{'price': '89.00', 'update_time': '2019-10-16'}",women
https://athleta.gap.com/browse/product.do?pid=487631002&cid=1023333&pcid=1006482&vid=1&grid=pds_54_193_1,https://athleta.gap.com/webcontent/0017/421/642/cn17421642.jpg,487631,['Black'],"['XXS', 'XS', 'S', 'M', 'L', 'XL']",Crescent 2-in-1 Short,7,"{'price': '69.00', 'update_time': '2019-10-16'}",athleta,"['Nylon/Elastane ', 'WICKING. Pulls sweat away from the body so it can evaporate faster ', 'QUICK-DRYING. Dries in a flash for the ultimate comfort when breaking a sweat ', 'BREATHABLE. Sweat can travel through the fabric so it can evaporate on the surface ', 'RATED UPF 50+ (Excellent Protection) ', 'Machine wash and dry. ', 'Imported. ', 'Product Details : FOR: Indoor and outdoor yoga practice, and life off the matFEEL: Powervita™  fabric is buttery soft to the touch with support that feels like a gentle hugFAVE: Inner shorts feel barely there but hug your body supportivelyStash pockets on side hold your essentialsMesh outer layer provides coverage and breathability #487631']",,,4.4,,"{'price': '69.00', 'update_time': '2019-10-16'}",women
https://athleta.gap.com/browse/product.do?pid=502398002&cid=1144189&pcid=1006482&vid=1&grid=pds_16_193_1,https://athleta.gap.com/webcontent/0017/662/010/cn17662010.jpg,502398,['Spring Night'],"['XXS', 'XS', 'S', 'M', 'L', 'XL']",Pure Luxe Leopard Print Sweatshirt,48,"{'price': '79.00', 'update_time': '2019-10-16'}",athleta,"['TENCEL™ Modal/Polyester/Lycra ', 'SUSTAINABLE: TENCEL™ Modal fiber is made from sustainably sourced wood pulp where 99% of the raw material comes from certified or controlled sources ', 'PACKABLE. Packs down small and comes out smooth as can be ', 'EASY CARE. Just throw in the wash and dry without a second thought ', 'Machine wash and dry. ', 'Imported. ', 'Product Details : FOR: Relaxed with room to moveFEEL: Nirvana is the softest fabric imaginableFAVE: Banded hem provides a stay-put live-in comfortable fit and on-trend leopard print. #502398']",,,4.9,,"{'price': '79.00', 'update_time': '2019-10-16'}",women
https://athleta.gap.com/browse/product.do?pid=870422162&cid=1023334&pcid=1006482&vid=1&grid=pds_114_193_1,https://athleta.gap.com/webcontent/0017/885/074/cn17885074.jpg,870422,['Rosario Pink'],"['XXS', 'XS', 'S', 'M', 'L', 'XL']",Coaster Luxe Sweatshirt,2273,"{'price': '79.00', 'update_time': '2019-10-16'}",athleta,"['Lenzing Modal®/Polyester/Lycra ', 'PLUSH NIRVANA. Serenely soft Lenzing Modal® blend has a brushed inner construction for warmth & coziness ', 'SUSTAINABLE: TENCEL Modal™ is a fiber that is produced from European beechwood trees harvested from sustainable forests where 99% of the raw material comes from certified or controlled sources. ', 'BREATHABLE. Sweat can travel through the fabric so it can evaporate on the surface ', 'IT FEELS: Lightweight, unbelievably soft, stretchy comfortable ', 'Machine wash and dry. ', 'Imported. ', 'Product Details : FOR: Commuting, work and travelFEEL: Plush Nirvana has a cozy brushed interiorFAVE: Longer hem length provides more coverageSide-slits for added mobility #870422']",,,4.7,,"{'price': '79.00', 'update_time': '2019-10-16'}",women
https://athleta.gap.com/browse/product.do?pid=486285002&cid=1023334&pcid=1006482&vid=1&grid=pds_87_193_1,https://athleta.gap.com/webcontent/0017/571/295/cn17571295.jpg,486285,['Black'],"['XS', 'S', 'M', 'L', 'XL']",Foresthill Merino Wool Ascent Tank,32,"{'price': '59.00', 'update_time': '2019-10-16'}",athleta,"['Wool/Nylon ', 'EASY CARE. Just throw in the wash and dry without a second thought ', 'BREATHABLE. Sweat can travel through the fabric so it can evaporate on the surface ', 'Machine wash and lay flat to dry. ', 'Imported. ', 'Product Details : FOR: Hiking, climbing and exploring-on the trail or offFEEL: Chafe-free seamless merino wool blend stretches with youFAVE: Targeted open-hole mesh provides cooling airflowRuching on side for a feminine detail #486285']",,,4.8,,"{'price': '59.00', 'update_time': '2019-10-16'}",women
https://athleta.gap.com/browse/product.do?pid=486693012&cid=1063661&pcid=1006482&vid=1&grid=pds_129_193_1,https://athleta.gap.com/webcontent/0017/759/469/cn17759469.jpg,486693,['Natural'],"['XXS', 'XS', 'S', 'M', 'L', 'XL']",Tugga Sherpa Jacket,38,"{'price': '128.00', 'update_time': '2019-10-16'}",athleta,"['Polyester ', 'EASY CARE. Just throw in the wash and dry without a second thought ', 'Machine wash and dry. ', 'Imported. ', 'Product Details : FOR: Hiking, climbing and exploring-on the trail or offFEEL: Unbelievably cozy sherpa fabric feels soft on the skinFAVE: Zip pockets secure your essentialsHigh collar for extra coziness #486693']",,,4.8,,"{'price': '128.00', 'update_time': '2019-10-16'}",women
https://athleta.gap.com/browse/product.do?pid=499333012&cid=1063661&pcid=1006482&vid=1&grid=pds_133_193_1,https://athleta.gap.com/webcontent/0017/888/440/cn17888440.jpg,499333,['White'],"['XXS', 'XS', 'S', 'M', 'L', 'XL']",Flurry Force Insulated PrimaLoft® Jacket,20,"{'price': '138.00', 'update_time': '2019-10-16'}",athleta,"['Nylon/Lycra ', 'WATER-REPELLENT. Sleek fabric wards off unexpected light rain ', 'SUSTAINABLE. PRIMALOFT® ECO offers a synthetic alternative to down insulation ', 'Machine wash and dry. ', 'Imported. ', 'Product Details : FOR: Medium and high impact workouts in cold climates.FEEL: Chafe-free seamless fabric stretches with every move.FAVE: Sleek, woven paneling with Primaloft® Eco insulation to provide weightless warmth.Zip pockets secure your essentials. #499333']",,,4.9,,"{'price': '138.00', 'update_time': '2019-10-16'}",women
https://athleta.gap.com/browse/product.do?pid=486373012&cid=1051661&pcid=1006482&vid=1&grid=pds_144_193_1,https://athleta.gap.com/webcontent/0017/778/673/cn17778673.jpg,374207,['Antique Burgundy/ Torch Red'],"['XS', 'S', 'M', 'L', 'XL']",Tenacity Mesh Plunge Bra,7,"{'price': '59.00', 'update_time': '2019-10-16'}",athleta,"['Polyester/Lycra ', 'BREATHABLE. Sweat can travel through the fabric so it can evaporate on the surface ', 'WICKING. Pulls sweat away from the body so it can evaporate faster ', 'RATED UPF 50+ (Excellent Protection) ', 'Machine wash and line dry. ', 'Imported. ', 'Product Details : FOR: Medium and high impact workouts at the gym, studio or outdoorsFEEL: PowerLift fabric feels smooth and cool in your hand, sleek and compressive on your body.FAVE: Targeted mesh ventilation provides cooling airflowEasy pocket for use of our Empower Pad Mastectomy Bra Insert (#374207) if needed #486373']",,,4.7,,"{'price': '59.00', 'update_time': '2019-10-16'}",women
https://athleta.gap.com/browse/product.do?pid=487674012&cid=1124332&pcid=1006482&vid=1&grid=pds_3_193_1,https://athleta.gap.com/webcontent/0017/646/243/cn17646243.jpg,487674,['Maple Red'],"['XXS', 'XS', 'S', 'M', 'L', 'XL']",Elation Ice Dye 7/8 Tight in Powervita™,50,"{'price': '89.00', 'update_time': '2019-10-16'}",athleta,"['Recycled Polyester/Lycra ', 'SUSTAINABLE: Made from Recycled Poly, a material sourced from post-consumer plastic bottles that helps lessen our impact on the world ', 'BREATHABLE. Sweat can travel through the fabric so it can evaporate on the surface ', 'QUICK-DRYING. Dries in a flash for the ultimate comfort when breaking a sweat ', 'WICKING. Pulls sweat away from the body so it can evaporate faster ', 'RATED UPF 50+ (Excellent Protection) ', 'Machine wash and dry. ', 'Imported. ', 'Product Details : FOR: Indoor and outdoor yoga practice, and life off the matFEEL: Powervita™  fabric is buttery soft to the touch with support that feels like a gentle hugFAVE: Unpinchable three-layer waistband with mesh inner lining streamlines and supportsBreathable CoolMax® crotch gusset #487674']",,,4.8,,"{'price': '89.00', 'update_time': '2019-10-16'}",women
https://athleta.gap.com/browse/product.do?pid=486286022&cid=1023334&pcid=1006482&vid=1&grid=pds_68_193_1,https://athleta.gap.com/webcontent/0017/713/519/cn17713519.jpg,486286,['Torch Red'],"['XS', 'S', 'M', 'L', 'XL']",Foresthill Merino Wool Ascent Top,28,"{'price': '74.00', 'update_time': '2019-10-16'}",athleta,"['Wool/Nylon ', 'EASY CARE. Just throw in the wash and dry without a second thought ', 'BREATHABLE. Targeted ventilation keeps the air moving ', 'Machine wash and lay flat to dry. ', 'Imported. ', 'Product Details : FOR: Hiking, climbing and exploring-on the trail or offHEEL: Chafe-free seamless merino wool blend stretches with youFAVE: Targeted open-hole mesh provides cooling airflowRuching on side for a feminine detail #486286']",,,4.5,,"{'price': '74.00', 'update_time': '2019-10-16'}",women
https://athleta.gap.com/browse/product.do?pid=485965002&cid=1123437&pcid=1006482&vid=1&grid=pds_178_193_1,https://athleta.gap.com/webcontent/0017/624/634/cn17624634.jpg,485965,['Quarry'],"['6', '6.5', '7', '7.5', '8', '8.5', '9', '9.5', '10', '11']",Whitney Short Boot by Sorel®,1,"{'price': '110.00', 'update_time': '2019-10-16'}",athleta,"['Nylon/Synthetic/Rubber ', 'Waterproof Nylon ', 'Wipe clean. ', 'Imported. ', 'Product Details : FOR: Get the traction and warmth you want for a winter or outdoor hikeFEEL: Soft microfleece lining and outer waterproof shell keeps you dry in the snowFAVE: 200 gram insulation keeps feet warm at ᆭ degrees F, ᆴ degrees C #485965']",,,5.0,,"{'price': '110.00', 'update_time': '2019-10-16'}",women
https://athleta.gap.com/browse/product.do?pid=486317022&cid=1023334&pcid=1006482&vid=1&grid=pds_57_193_1,https://athleta.gap.com/webcontent/0017/713/643/cn17713643.jpg,486317,['Black/ Norwegian Grey'],"['XS', 'S', 'M', 'L', 'XL']",Flurry Peak Turtleneck,14,"{'price': '89.00', 'update_time': '2019-10-16'}",athleta,"['Nylon ', 'UNSTINKABLE. Odor-controlling yarns ', 'BREATHABLE. Sweat can travel through the fabric so it can evaporate on the surface ', 'WICKING. Pulls sweat away from the body so it can evaporate faster ', 'UPF 50+ ', 'Machine wash and dry. ', 'Imported. ', 'Product Details : FOR: Medium and high impact workouts in cold climatesFEEL: Chafe-free seamless fabric stretches with every moveFAVE: Thumbholes keep your sleeves in place #486317']",,,4.7,,"{'price': '89.00', 'update_time': '2019-10-16'}",women
https://athleta.gap.com/browse/product.do?pid=405743052&cid=1051661&pcid=1006482&vid=1&grid=pds_146_193_1,https://athleta.gap.com/webcontent/0017/661/926/cn17661926.jpg,374207,['Torch Red'],"['XS', 'S', 'M', 'L', 'XL']",A-C Contender Bra,284,"{'price': '54.00', 'update_time': '2019-10-16'}",athleta,"['Polyester/Lycra® Spandex ', 'WICKING. Pulls sweat away from the body so it can evaporate faster ', 'BREATHABLE. Sweat can travel through the fabric so it can evaporate on the surface ', 'RATED UPF 50+ (Excellent Protection) ', 'Machine wash and line dry. ', 'Imported. ', 'Product Details : FOR: Medium and high impact workoutsFEEL: PowerLift has sleek and supportive compressionFAVE: Targeted mesh ventilation provides airflow where you need itEasy pocket for use of our Empower Mastectomy Bra Insert (#374207) if needed #405743']",,,4.6,,"{'price': '24.97', 'update_time': '2019-10-16'}",women
https://athleta.gap.com/browse/product.do?pid=486718002&cid=1123437&pcid=1006482&vid=1&grid=pds_188_193_1,https://athleta.gap.com/webcontent/0017/624/693/cn17624693.jpg,486718,['Black Reflective'],"['S/M', 'M/L']",Intent Reflective Glove,1,"{'price': '42.00', 'update_time': '2019-10-16'}",athleta,"['Polyester ', 'WICKING. Pulls sweat away from the body so it can evaporate faster ', 'WATER-RESISTANT. Sleek fabric wards off unexpected light rain ', 'WIND-RESISTANT. Stops wind from passing through the fabric and giving you a chill ', 'Machine wash and lay flat to dry. ', 'Imported. ', 'Product Details : FOR: Medium and high impact workouts in cold climatesFEEL: Lightweight, stretchy fabricationFAVE: Touchscreen compatible fingers for easy smartphone use and small pocket at wrist for key.Reflective details for early morning or after-dusk workouts #486718']",,,5.0,,"{'price': '42.00', 'update_time': '2019-10-16'}",women
https://athleta.gap.com/browse/product.do?pid=486858002&cid=1023334&pcid=1006482&vid=1&grid=pds_86_193_1,https://athleta.gap.com/webcontent/0017/424/275/cn17424275.jpg,486858,['Black'],"['XS', 'S', 'M', 'L', 'XL']",Speedlight City Bloom Tank,11,"{'price': '49.00', 'update_time': '2019-10-16'}",athleta,"['Nylon ', 'UNSTINKABLE. Odor-controlling yarns ', 'BREATHABLE. Sweat can travel through the fabric so it can evaporate on the surface ', 'RATED UPF 50+ (Excellent Protection) ', 'Machine wash and dry. ', 'Imported. ', 'Product Details : FOR: Medium and high-impact workoutsFEEL: Chafe-free seamless fabric stretches with every moveFAVE: Hem-grippers give you a stay-put fit #486858']",,,5.0,,"{'price': '49.00', 'update_time': '2019-10-16'}",women
https://athleta.gap.com/browse/product.do?pid=487745032&cid=1023333&pcid=1006482&vid=1&grid=pds_46_193_1,https://athleta.gap.com/webcontent/0017/889/759/cn17889759.jpg,487745,['Hibiscus Red'],"['XXS', 'XS', 'S', 'M', 'L', 'XL']",Rainier Tight in Plush SuperSonic,13,"{'price': '98.00', 'update_time': '2019-10-16'}",athleta,"['Recycled Nylon/Lycra ', 'SUSTAINABLE: Made with Recycled Nylon, a high-performance material that helps lessen our impact on the world ', 'BREATHABLE. Sweat can travel through the fabric so it can evaporate on the surface ', 'QUICK-DRYING. Dries in a flash for the ultimate comfort when breaking a sweat ', 'WICKING. Pulls sweat away from the body so it can evaporate faster ', 'Machine wash and dry. ', 'Imported. ', 'Product Details : FOR: Medium and high impact workouts in cold climatesFEEL: Plush SuperSonic has a soft, brushed interiorFAVE: Zip pockets secure your essentialsBack drop-in pocket stashes your smartphoneReflective details for early morning or after-dusk workouts #487745']",,,4.5,,"{'price': '98.00', 'update_time': '2019-10-16'}",women
https://athleta.gap.com/browse/product.do?pid=372201022&cid=1063661&pcid=1006482&vid=1&grid=pds_138_193_1,https://athleta.gap.com/webcontent/0017/661/041/cn17661041.jpg,372201,['Antique Burgundy'],"['XXS', 'XS', 'S', 'M', 'L', 'XL']",Circa Track Jacket,80,"{'price': '118.00', 'update_time': '2019-10-16'}",athleta,"['Nylon/Spandex ', 'WICKING. Pulls sweat away from the body so it can evaporate faster ', 'BREATHABLE. Sweat can travel through the fabric so it can evaporate on the surface ', 'RATED UPF 50+ (Excellent Protection) ', 'Machine wash and dry. ', 'Imported. ', 'Product Details : FOR: Medium and high impact workouts at the gym, studio or outdoorsFEEL: Lightweight Pilayo® fabric stretches with every moveFAVE: Knit track stripe along arms stands out while you sweatEasy-access front pockets, sneaky internal pocketThumbholes to keep sleeves in place #372201']",,,4.8,,"{'price': '118.00', 'update_time': '2019-10-16'}",women
